[
  {
    "id": "9042a029-4d1a-44e0-8982-5ba2d290c5f8",
    "wallet_id": "mbc_f4527e404334215d",
    "type": "credit",
    "amount_btc": "0.00000002",
    "date": "2025-12-25",
    "source": "daily_mining_earnings",
    "ref": "daily_mining_earnings:2025-12-25",
    "timestamp": "2026-02-12T18:01:40.243Z",
    "signature": "T8e6I/WUIC2v45pVCIy36Eh1G/eZQjnifrqOaUKDhl2l9s38EXGnvmqY1Zt/5EGQhAoM7P+OSLR4weVr2aLECA=="
  },
  {
    "id": "9b7f3357-0af4-43f8-b1aa-70e4921ef54f",
    "wallet_id": "mbc_9b28d5660930cec5",
    "type": "credit",
    "amount_btc": "0.00000001",
    "date": "2025-12-25",
    "source": "daily_mining_earnings",
    "ref": "daily_mining_earnings:2025-12-25",
    "timestamp": "2026-02-12T18:01:40.243Z",
    "signature": "BnIvQSBkZMbq+xpjY25y8PZgpzTDvvC/Lg9OdbuVd+KDpNc/DW3cOpgtf6FRhgc9+X5XNY4PKHsWv2zcXfjCCw=="
  },
  {
    "id": "947bb323-f341-494b-9829-e0c8039054f0",
    "wallet_id": "mbc_aa821f4012a32c44",
    "type": "credit",
    "amount_btc": "0.00000002",
    "date": "2025-12-25",
    "source": "daily_mining_earnings",
    "ref": "daily_mining_earnings:2025-12-25",
    "timestamp": "2026-02-12T18:01:40.244Z",
    "signature": "+HUyWyxUSDvPW9gzoTa6E2DTfFM8SVNa5TB4dy5cqlok4zcKHEM8YE2UNpMblaAfIuylbiS2YfXk9jbNe2pdCQ=="
  },
  {
    "id": "c070222f-b645-4b27-a0e4-7ce3c38114c3",
    "wallet_id": "mbc_c7ed4396f5eebf5d",
    "type": "credit",
    "amount_btc": "0.00000031",
    "date": "2025-12-25",
    "source": "daily_mining_earnings",
    "ref": "daily_mining_earnings:2025-12-25",
    "timestamp": "2026-02-12T18:01:40.244Z",
    "signature": "ZVYfTQXU6knTUBzCmhkGte/RMnWjsMF1WCNWT9+IsJnO9G4WjLwKQMtXeX/anUWXWL3d5ZWaQKd0sp6mGsJiDQ=="
  }
]
