[
  {
    "id": "3684a88e-a064-4a04-ba9a-853cb62d7735",
    "wallet_id": "mbc_f4527e404334215d",
    "type": "credit",
    "amount_btc": "0.00061420",
    "date": "2025-09-09",
    "source": "daily_mining_earnings",
    "ref": "daily_mining_earnings:2025-09-09",
    "timestamp": "2026-02-12T18:01:40.002Z",
    "signature": "jin4Lu7a5StE0uLOAH005TWGXEExnp7gzc2Sfg9O0f6XItMLWy3LUWsXPassQNx1J9PPHq/K2WiZwU+JX/2NAg=="
  },
  {
    "id": "e3b729db-a5e4-42d1-9e29-c427b610bfa4",
    "wallet_id": "mbc_9b28d5660930cec5",
    "type": "credit",
    "amount_btc": "0.00020473",
    "date": "2025-09-09",
    "source": "daily_mining_earnings",
    "ref": "daily_mining_earnings:2025-09-09",
    "timestamp": "2026-02-12T18:01:40.002Z",
    "signature": "zLijvbPni6MEW4CiZI/v1DvnqF/MnK8FG18xBQ2hwUzdfFM6oRNalxtwDt0clN/mWKQjpIFtIh9BClNJAjfWAw=="
  },
  {
    "id": "5af67438-dbd8-4250-9bf7-924a06ffe26e",
    "wallet_id": "mbc_aa821f4012a32c44",
    "type": "credit",
    "amount_btc": "0.00061420",
    "date": "2025-09-09",
    "source": "daily_mining_earnings",
    "ref": "daily_mining_earnings:2025-09-09",
    "timestamp": "2026-02-12T18:01:40.003Z",
    "signature": "c3XhbHsh2HuwH8jRU/vjUijbCqDdup86Lxx7YEE6x6OfsAe9dxrki2hAEpzuMG1Gdw5liuIYNr9zz9s32I0hCQ=="
  },
  {
    "id": "e6ddb1d6-6b7d-407f-8221-969ada8fe861",
    "wallet_id": "mbc_8fde24113463b465",
    "type": "credit",
    "amount_btc": "0.00010237",
    "date": "2025-09-09",
    "source": "daily_mining_earnings",
    "ref": "daily_mining_earnings:2025-09-09",
    "timestamp": "2026-02-12T18:01:40.004Z",
    "signature": "MD8KGmQoAccOsrVP1W4aqC6Spp5Q1toQ/mzS7PId56q2VkGw5JU85ouu3NopxRtaw93OyInM3eBoHTWFoa6hBw=="
  },
  {
    "id": "82825e50-0228-4c34-bb10-0f24a581feaa",
    "wallet_id": "mbc_845c0b9c056fdcdb",
    "type": "credit",
    "amount_btc": "0.00010237",
    "date": "2025-09-09",
    "source": "daily_mining_earnings",
    "ref": "daily_mining_earnings:2025-09-09",
    "timestamp": "2026-02-12T18:01:40.004Z",
    "signature": "SOwf4GbWsA5cCv3feVaQp0MR7U51Y2VDQf8Job4WFuW40EkUwpj60sU1pd9eo5yTP82qNRwXwNP6pWlht1GOAg=="
  },
  {
    "id": "60509a28-6965-4ea5-a002-c0502a171812",
    "wallet_id": "mbc_004ea49ed2970ec4",
    "type": "credit",
    "amount_btc": "0.00010237",
    "date": "2025-09-09",
    "source": "daily_mining_earnings",
    "ref": "daily_mining_earnings:2025-09-09",
    "timestamp": "2026-02-12T18:01:40.004Z",
    "signature": "Cgs0bkO7WxIHmWK9zYZSnfKuQ+3u/WKgDh/uWR/WCrYXGbgGkv3K/W+HgXzMWzIVsfzbWNlv6ApZpW6FdvCFAA=="
  },
  {
    "id": "3e28f0ae-ad88-4c00-bfcc-216a469bc3dc",
    "wallet_id": "mbc_c7ed4396f5eebf5d",
    "type": "credit",
    "amount_btc": "0.00797431",
    "date": "2025-09-09",
    "source": "daily_mining_earnings",
    "ref": "daily_mining_earnings:2025-09-09",
    "timestamp": "2026-02-12T18:01:40.005Z",
    "signature": "1JED3dDtZzoe2NUg5Lj4QQ8X096TKur/y2XVGejcGFYlnyBcgrWiPiCJ5TvBik2+pqvoeADKu0Suoc9HzYksBw=="
  }
]
