[
  {
    "id": "9e763a21-37df-48a2-a242-f1aa6084fb99",
    "wallet_id": "mbc_f4527e404334215d",
    "type": "credit",
    "amount_btc": "0.00059969",
    "date": "2025-07-16",
    "source": "daily_mining_earnings",
    "ref": "daily_mining_earnings:2025-07-16",
    "timestamp": "2026-02-12T18:01:39.857Z",
    "signature": "ncYumGq20W9W7lR51XxIWsfMiN3eROr+CQOWxlAUf0oUcmAfq/3bqejmlY1LIRYfRLkH9vRRcY0wGLpAm0OcAQ=="
  },
  {
    "id": "bdac83d3-b579-4474-b913-9bc6a9fcacfe",
    "wallet_id": "mbc_9b28d5660930cec5",
    "type": "credit",
    "amount_btc": "0.00019990",
    "date": "2025-07-16",
    "source": "daily_mining_earnings",
    "ref": "daily_mining_earnings:2025-07-16",
    "timestamp": "2026-02-12T18:01:39.857Z",
    "signature": "V0QlKA16D/Lg8gZnYJVnQjWK69GrPH3mKTTNz2e0qj6dS3KRmU9b8hgfi8OowoNGnBvWhdPEoAuclb7WwzP4Bg=="
  },
  {
    "id": "41dfe152-7523-4c4d-b1d2-b955bfc3721e",
    "wallet_id": "mbc_aa821f4012a32c44",
    "type": "credit",
    "amount_btc": "0.00059969",
    "date": "2025-07-16",
    "source": "daily_mining_earnings",
    "ref": "daily_mining_earnings:2025-07-16",
    "timestamp": "2026-02-12T18:01:39.858Z",
    "signature": "AeQ9auJ2pfNTjBKHGYlw9gKfMFvAIOegIUevIa8PJ6Vn7uoML9tGa0/DZ7vqHnrEn1mpRS5vArNx7yNeh36vDw=="
  },
  {
    "id": "fe6a9b20-0e1b-4979-9cee-49503c643473",
    "wallet_id": "mbc_8fde24113463b465",
    "type": "credit",
    "amount_btc": "0.00009995",
    "date": "2025-07-16",
    "source": "daily_mining_earnings",
    "ref": "daily_mining_earnings:2025-07-16",
    "timestamp": "2026-02-12T18:01:39.858Z",
    "signature": "CyZfLXMuYDZ4/WdagPGQF0amRyl668c+hetzmqufisFPeu5NR3oY1Zw/DzyNqlKd/1hvo7ka6YWlNF9bMb9xBQ=="
  },
  {
    "id": "36efcd39-cf23-42cc-bd15-ade62d81449b",
    "wallet_id": "mbc_845c0b9c056fdcdb",
    "type": "credit",
    "amount_btc": "0.00009995",
    "date": "2025-07-16",
    "source": "daily_mining_earnings",
    "ref": "daily_mining_earnings:2025-07-16",
    "timestamp": "2026-02-12T18:01:39.858Z",
    "signature": "N8/oOY0WlQo7be56IIj/h/uy3NvXYDtXMinBfGXWzoYHgV+WcyPCWbhsQ80D9mIYud7fCri58M6Y0T8VX/ZxBA=="
  },
  {
    "id": "a1143053-170a-4004-8dbe-b7da4a110796",
    "wallet_id": "mbc_004ea49ed2970ec4",
    "type": "credit",
    "amount_btc": "0.00009995",
    "date": "2025-07-16",
    "source": "daily_mining_earnings",
    "ref": "daily_mining_earnings:2025-07-16",
    "timestamp": "2026-02-12T18:01:39.859Z",
    "signature": "ozT/c2yrgKMY/yAEoYqwx+pgJ9dgLCRk+lrDtv8Ds5p63oU9xaypmtZ1u9wjtfN8PTeH572maU+6Ob3ZvaLBCA=="
  },
  {
    "id": "fe3ac6bc-81e5-4f97-8be5-890941fffb46",
    "wallet_id": "mbc_c7ed4396f5eebf5d",
    "type": "credit",
    "amount_btc": "0.00778595",
    "date": "2025-07-16",
    "source": "daily_mining_earnings",
    "ref": "daily_mining_earnings:2025-07-16",
    "timestamp": "2026-02-12T18:01:39.860Z",
    "signature": "x40oXutSkz+EGdie9mB4Q1mJG7r4cSHBZcqk6ZlWvvmntJxwOB6eHfmnfcb1MStUI4zj86jJQyx2EUHMFcR0Aw=="
  }
]
