[
  {
    "id": "ed579ca3-0129-43d7-b5aa-b34c1d3eeef5",
    "wallet_id": "mbc_f4527e404334215d",
    "type": "credit",
    "amount_btc": "0.00061875",
    "date": "2025-08-24",
    "source": "daily_mining_earnings",
    "ref": "daily_mining_earnings:2025-08-24",
    "timestamp": "2026-02-12T18:01:39.960Z",
    "signature": "zyTB9d8HbTLxXOcPpDIttvUigFMDDx1N5gAS5dxm4yNnGm/UeXwNvkddcU18Bi5XPFYzcnyZWTYBLxkm4S9vBw=="
  },
  {
    "id": "e722930c-8a7b-48c3-94c9-9ab748f53ea2",
    "wallet_id": "mbc_9b28d5660930cec5",
    "type": "credit",
    "amount_btc": "0.00020625",
    "date": "2025-08-24",
    "source": "daily_mining_earnings",
    "ref": "daily_mining_earnings:2025-08-24",
    "timestamp": "2026-02-12T18:01:39.961Z",
    "signature": "NSLiPkba0E9s1NVYNeIhhBbbbGWHmn6Wq3ccR766GkrjdayFVRhLI3Ll8+dYnsQZont2wcwvrpmTHxlmlMC2Cg=="
  },
  {
    "id": "23364c76-bcae-4480-ac59-b4292cdc8f54",
    "wallet_id": "mbc_aa821f4012a32c44",
    "type": "credit",
    "amount_btc": "0.00061875",
    "date": "2025-08-24",
    "source": "daily_mining_earnings",
    "ref": "daily_mining_earnings:2025-08-24",
    "timestamp": "2026-02-12T18:01:39.961Z",
    "signature": "I+Ki2ZKY3JKfpIfsX1jZtqzU5rx+3XHvBR5Rd/LpysFFhqk56wJdLZO4S0IRDXwZwJQ85wkEdIGW1c/Cx6cIBg=="
  },
  {
    "id": "372107d8-4db9-44dc-a4ee-854aa9436342",
    "wallet_id": "mbc_8fde24113463b465",
    "type": "credit",
    "amount_btc": "0.00010313",
    "date": "2025-08-24",
    "source": "daily_mining_earnings",
    "ref": "daily_mining_earnings:2025-08-24",
    "timestamp": "2026-02-12T18:01:39.961Z",
    "signature": "ylZBSgBPj83ZkXRFpWEjpxEj+h74z1C2q1hCrTGmsU9ijDCBB+bOOfkEXF0uft/Xkgx2N+wpD1UZ1GKpuI+8BQ=="
  },
  {
    "id": "fecb2184-0572-4f5d-bba5-03ee8b5d0a96",
    "wallet_id": "mbc_845c0b9c056fdcdb",
    "type": "credit",
    "amount_btc": "0.00010313",
    "date": "2025-08-24",
    "source": "daily_mining_earnings",
    "ref": "daily_mining_earnings:2025-08-24",
    "timestamp": "2026-02-12T18:01:39.962Z",
    "signature": "00cOsVN22cKaf6HoLiC5sNLBFp7QlzzSFnQy/vYrnDFftm+2xmff2X2//qCdFct5IVP0v3qIPJy83VSwVXrtBQ=="
  },
  {
    "id": "1b24a8c4-752a-4535-85b4-7d0eacca56a5",
    "wallet_id": "mbc_004ea49ed2970ec4",
    "type": "credit",
    "amount_btc": "0.00010313",
    "date": "2025-08-24",
    "source": "daily_mining_earnings",
    "ref": "daily_mining_earnings:2025-08-24",
    "timestamp": "2026-02-12T18:01:39.962Z",
    "signature": "pxXQC0q6dyjf26m7qBJxX46w4TwnHJMaIuzlRQrrvpoXOjIYex9fBrP28oPJsBQ17L7GxlcYYZ4egfACaw+BCA=="
  },
  {
    "id": "c7e84e9e-89c5-41fd-b89d-189ebeba029f",
    "wallet_id": "mbc_c7ed4396f5eebf5d",
    "type": "credit",
    "amount_btc": "0.00803344",
    "date": "2025-08-24",
    "source": "daily_mining_earnings",
    "ref": "daily_mining_earnings:2025-08-24",
    "timestamp": "2026-02-12T18:01:39.962Z",
    "signature": "YR4H+XvSL/6hf53B/9lxvgwseGDdVsETgOoCxntMXSMUdhjthR4kmVj3hMGdpQsVVVuTnXanw6XIKQc2BTvrCA=="
  }
]
