[
  {
    "id": "f7e15a5a-f3a1-4b10-a6c2-f92dd3142514",
    "wallet_id": "mbc_f4527e404334215d",
    "type": "credit",
    "amount_btc": "0.00054016",
    "date": "2025-10-11",
    "source": "daily_mining_earnings",
    "ref": "daily_mining_earnings:2025-10-11",
    "timestamp": "2026-02-12T18:01:40.086Z",
    "signature": "gebfI7sHSl+oOf6EFwaavMzodC9xV3wOuRlZoCIbtxd4dlmV2zQJYuBMsxpiGvGgShkwjoZ0nbC1z8gi1gTqCA=="
  },
  {
    "id": "37716437-9499-4ada-a8c7-a844ff051ed0",
    "wallet_id": "mbc_9b28d5660930cec5",
    "type": "credit",
    "amount_btc": "0.00018005",
    "date": "2025-10-11",
    "source": "daily_mining_earnings",
    "ref": "daily_mining_earnings:2025-10-11",
    "timestamp": "2026-02-12T18:01:40.086Z",
    "signature": "P+G+Se2YbLuLMoVS1T1a60kxTDpeyV2XPxQHqSAKP3C5/wdPz1+8xEyMoFLbSkxZKm1edARZM+DbaRFTo7S5Cg=="
  },
  {
    "id": "6271a0c9-ade2-4743-8080-77feb609f6eb",
    "wallet_id": "mbc_aa821f4012a32c44",
    "type": "credit",
    "amount_btc": "0.00054016",
    "date": "2025-10-11",
    "source": "daily_mining_earnings",
    "ref": "daily_mining_earnings:2025-10-11",
    "timestamp": "2026-02-12T18:01:40.086Z",
    "signature": "L/6qILHmg4iTE665PmfYB67Ea8e/tJQ/VicKWnJ0QNwaAWbWUEpWKOTk0nqyLdqxh3XvRqJZykyq1c6blYWpDQ=="
  },
  {
    "id": "35644b6f-abfa-4738-93fc-d2d87d9b5f7c",
    "wallet_id": "mbc_8fde24113463b465",
    "type": "credit",
    "amount_btc": "0.00009003",
    "date": "2025-10-11",
    "source": "daily_mining_earnings",
    "ref": "daily_mining_earnings:2025-10-11",
    "timestamp": "2026-02-12T18:01:40.087Z",
    "signature": "0waklTL0VoHfo9jHiVJcQgMCcTI1YIRZ3Uqo0XCY3sSXDsF4n9s1mZ1Ighjf4wohDBsWyqjHJykbpcEXQdTUDA=="
  },
  {
    "id": "96d2eaac-b5ae-446c-945a-4f60d186e9f5",
    "wallet_id": "mbc_845c0b9c056fdcdb",
    "type": "credit",
    "amount_btc": "0.00009003",
    "date": "2025-10-11",
    "source": "daily_mining_earnings",
    "ref": "daily_mining_earnings:2025-10-11",
    "timestamp": "2026-02-12T18:01:40.087Z",
    "signature": "YRVraxMkLwhWrKfRjljyNopmqMqwxjj4yFPNzCyg9DnkUaMaWRkGWAnH+3rWdMLHeA2TGnh1Q3Ayvx0suQSfAQ=="
  },
  {
    "id": "33be55d2-0504-4216-8a32-95034ce0e6b0",
    "wallet_id": "mbc_004ea49ed2970ec4",
    "type": "credit",
    "amount_btc": "0.00009003",
    "date": "2025-10-11",
    "source": "daily_mining_earnings",
    "ref": "daily_mining_earnings:2025-10-11",
    "timestamp": "2026-02-12T18:01:40.087Z",
    "signature": "lV//2Yv9OohD6lpM29vJ2XAU2bzuGkDdY8CIvgSThYTGAqUs7TIKQtT9UxadfvFp3LMeP7bjUnPbDHjQ9aDlCg=="
  },
  {
    "id": "b04766c6-9078-4066-a9b9-136ab512f03a",
    "wallet_id": "mbc_c7ed4396f5eebf5d",
    "type": "credit",
    "amount_btc": "0.00701303",
    "date": "2025-10-11",
    "source": "daily_mining_earnings",
    "ref": "daily_mining_earnings:2025-10-11",
    "timestamp": "2026-02-12T18:01:40.088Z",
    "signature": "13qJ4UP+wUKdgyOXSjZFDV7XLV+YMM5T6WPdu2H726pb8sTd97ud03Ory+S3DOhVn915fV8HeWM5j8jM0STiBA=="
  }
]
